"","X","artist_name","album_name","song_name","line"
"16",3,"linkin park","Meteora","Faint","I am a little bit of lonelinessA little bit of disregardHandful of complaints, but I can't help the factThat everyone can see these scarsI am what I want you to wantWhat I want you to feelBut it's like no matter what I do, I can't convince youTo just believe this is realSo I let go, watchin' youTurn your back like you always doFace away and pretend that I'm notBut I'll be here, 'cause you're all that I've gotI can't feel the way I did beforeDon't turn your back on me, I won't be ignoredTime won't heal this damage anymoreDon't turn your back on me, I won't be ignoredI am a little bit insecureA little unconfident'Cause you don't understand, I do what I canBut sometimes, I don't make senseI am what you never want to sayBut I've never had a doubtIt's like no matter what I do, I can't convince youFor once, just to hear me outSo I let go, watchin' youTurn your back like you always doFace away and pretend that I'm notBut I'll be here, 'cause you're all that I've gotI can't feel the way I did beforeDon't turn your back on me, I won't be ignoredTime won't heal this damage anymoreDon't turn your back on me, I won't be ignoredNo, hear me out nowYou're gonna listen to me, like it or notRight now, hear me out nowYou're gonna listen to me, like it or notRight nowI can't feel the way I did beforeDon't turn your back on me, I won't be ignoredI can't feel the way I did beforeDon't turn your back on me, I won't be ignoredTime won't heal this damage anymoreDon't turn your back on me, I won't be ignoredI can't feelDon't turn your back on me, I won't be ignoredTime won't healDon't turn your back on me, I won't be ignored"
"17",4,"linkin park","Meteora","Figure.09","Nothin' ever stops all these thoughts and the pain attached to themSometimes I wonder why this is happenin'It's like nothin' I could do will distract me whenI think of how I shot myself in the back again'Cause from the infinite words I could sayI put all the pain you gave to me on displayBut didn't realize instead of settin' it freeI took what I hated and made it a part of meNever goes awayNever goes awayAnd now you've become a part of me (You'll always be right here)You've become a part of me (You'll always be my fear)I can't separate myself from what I've doneGiving up a part of me, I've let myself become youHearin' your name, the memories come back againI remember when it started happenin'I'd see you in every thought I had and thenThe thoughts slowly found words attached to themAnd I knew as they escaped awayI was committin' myself to 'em and every dayI regret sayin' those things 'cause now I see that ITook what I hated and made it a part of meNever goes awayNever goes awayAnd now you've become a part of me (You'll always be right here)You've become a part of me (You'll always be my fear)I can't separate myself from what I've doneGiving up a part of me, I've let myself become youNever goes awayNever goes awayIt never goes awayIt never goes away (Get away from me)Gimme my space back, you gotta just (Go)Everything comes down to memories of (You)I've kept it in, but now I'm lettin' you (Know)I've let you go, so get away from meGimme my space back, you gotta just (Go)Everything comes down to memories of (You)I've kept it in, but now I'm lettin' you (Know)I've let you goAnd now you've become a part of me (You'll always be right here)You've become a part of me (You'll always be my fear)I can't separate myself from what I've doneGiving up a part of me, I've let myself become youI've let myself become youI've let myself become lost inside these thoughts of youGiving up a part of me, I've let myself become you"
"18",5,"linkin park","Meteora","From the Inside","I don't know who to trust, no surpriseEveryone feels so far away from meHeavy thoughts sift through dust and the liesTryin' not to break, but I'm so tired of this deceitEvery time I try to make myself get back up on my feet(I) All I ever think about is this, all the tiring time betweenAnd how trying to put my trust in you just takes so much out of meTake everything from the insideAnd throw it all away'Cause I swear, for the last timeI won't trust myself with youTension is building inside, steadilyEveryone feels so far away from meHeavy thoughts forcing their way out of meTryin' not to break, but I'm so tired of this deceitEvery time I try to make myself get back up on my feet(I) All I ever think about is this, all the tiring time betweenAnd how trying to put my trust in you just takes so much out of meTake everything from the insideAnd throw it all away'Cause I swear, for the last timeI won't trust myself with youI won't waste myself on you, you, youWaste myself on you, you, youI'll take everything from the insideAnd throw it all away'Cause I swear, for the last timeI won't trust myself with youEverything from the insideAnd just throw it all away'Cause I swear, for the last timeI won't trust myself with you, you, you"
"19",6,"linkin park","Meteora","Hit the Floor","There are just too many times that people have tried to look inside of meWondering what I think of you and I protect you out of courtesyToo many times that I've held on when I needed to push awayAfraid to say what was on my mind, afraid to say what I need to sayToo many things that you've said about me when I'm not aroundYou think havin' the upper hand means you gotta keep puttin' me downBut I've had too many stand-offs with you, it's about as much as I can standSo I'm waitin' until the upper hand is mineOne minute, you're on topThe next you're not, watch it dropMakin' your heart stopJust before you hit the floorOne minute, you're on topThe next you're not, missed your shotMakin' your heart stopYou think you won, and then it's all goneSo many people like me put so much trust in all your liesSo concerned with what you think to just say what we feel insideSo many people like me walk on eggshells all day longAll I know is that all I want is to feel like I'm not stepped onThere are so many things you say that make me feel you crossed the lineWhat goes up will surely fall, and I'm countin' down the time'Cause I've had so many stand-offs with you, it's about as much as I can standSo I'm waitin' until the upper hand is mineOne minute, you're on topThe next you're not, watch it dropMakin' your heart stopJust before you hit the floorOne minute, you're on topThe next you're not, missed your shotMakin' your heart stopYou think you wonAnd then it's all goneAnd then it's all goneAnd then it's all goneAnd then it's all goneNow it's all goneI know I'll never trust a single thing you sayYou knew your lies would divide us, but you lied anywayAnd all the lies have got you floating up above us allBut what goes up has got to fallOne minute, you're on topThe next you're not, watch it dropMakin' your heart stopJust before you hit the floorOne minute, you're on topThe next you're not, missed your shotMakin' your heart stopYou think you wonAnd then it's all goneAnd then it's all goneAnd then it's all goneAnd then it's all goneNow it's all gone"
"20",7,"linkin park","Meteora","Lying from You","When I pretend everything is what I want it to beI look exactly like what you had always wanted to seeWhen I pretend, I can forget about the criminal I amStealin' second after second just 'cause I know I can, butI can't pretend this is the way it'll stayI'm just trying to bend the truthI can't pretend I'm who you want me to beSo I'm lying my way fromYou(No, no turning back now)I wanna be pushed aside, so let me go(No, no turning back now)Let me take back my life, I'd rather be all alone(No turning back now)Anywhere on my own, 'cause I can see(No, no turning back now)The very worst part of you is meI remember what they taught to meRemember condescending talk of who I ought to beRemember listenin' to all of that and this againSo I pretended up a person who was fittin' inAnd now, you think this person really is meAnd I'm trying to bend the truthBut the more I push, the more I'm pullin' away'Cause I'm lying my way fromYou(No, no turning back now)I wanna be pushed aside, so let me go(No, no turning back now)Let me take back my life, I'd rather be all alone(No turning back now)Anywhere on my own, 'cause I can see(No, no turning back now)The very worst part of youThe very worst part of you is meThis isn't what I wanted to beI never thought that what I said would have you running from meLike this, this isn't what I wanted to beI never thought that what I said would have you running from meLike this (This) this isn't what I wanted to beI never thought that what I said would have you running from meLike this (This) this isn't what I wanted to beI never thought that what I said would have you running from meLike thisYou(No turning back now)I wanna be pushed aside, so let me go(No, no turning back now)Let me take back my life, I'd rather be all alone(No turning back now)Anywhere on my own, 'cause I can see(No, no turning back now)The very worst part of youThe very worst part of you is me"
"21",8,"linkin park","Meteora","Nobody’s Listening","Com-com-com-com-comin' at youCom—, at you, com-comin' at youYo, peep the style and the kids checkin' for itThe number one question is ""how could you ignore it?""We drop right back in the cut over basement tracksWith raps that got you backin' this up like ""rewind that""We're just rollin' with the rhythmRise from the ashes of stylistic divisionWith these non-stop lyrics of life livin'Not to be forgotten but still unforgivenBut in the meantime, there are thoseWho wanna talk this and that, so I supposeThat it gets to a point where feelings gotta get hurtAnd get dirty with the people spreadin' the dirt, it ​goesTry to give you warningBut everyone ignores meTold you everything loud and clearBut nobody's listeningCall to you so clearlyBut you don't want to hear meTold you everything loud and clearBut nobody's listeningI got a heart full of pain, head full of stressHandful of anger held in my chestAnd everything left's a waste of timeI hate my rhymes but hate everyone else's moreI'm ridin' on the back of this pressureGuessin' that it's better I can't keep myself togetherBecause all of this stress gave me somethin' to write onThe pain gave me somethin' I could set my sights onYou never forget the blood, sweat, and tearsThe uphill struggle over years, the fearAnd trash-talkin' and the people it was toAnd the people that started it, just like youTry to give you warningBut everyone ignores meTold you everything loud and clearBut nobody's listeningCall to you so clearlyBut you don't want to hear meTold you everything loud and clearBut nobody's listeningI got a heart full of pain, head full of stressHandful of anger held in my chestUphill struggle, blood, sweat, and tearsNothin' to gain, everything to fearHeart full of pain, head full of stressHandful of anger held in my chestUphill struggle, blood, sweat, and tearsNothin' to gain, everything to fearHeart full of painTry to give you warningBut everyone ignores meTold you everything loud and clearBut nobody's listeningCall to you so clearlyBut you don't want to hear meTold you everything loud and clearBut nobody's listeningI got a heart full of pain, head full of stressNobody's listeningHandful of anger held in my chestNobody's listeningUphill struggle, blood, sweat, and tearsNobody's listeningNothin' to gain, everything to fearNobody's listeningCom-com-com-com-comin' at youCom-comin', comin', comin', comin' at youCom-comin', come-com-comin' atCom-com-com-com-comin' at you from every side"
"22",9,"linkin park","Meteora","Numb","I'm tired of being what you want me to beFeeling so faithless, lost under the surfaceI don't know what you're expecting of mePut under the pressure of walking in your shoesCaught in the undertow, just caught in the undertowEvery step that I take is another mistake to youCaught in the undertow, just caught in the undertowI've become so numb, I can't feel you thereBecome so tired, so much more awareI'm becoming this, all I want to doIs be more like me and be less like youCan't you see that you're smothering me?Holding too tightly, afraid to lose control'Cause everything that you thought I would beHas fallen apart, right in front of youCaught in the undertow, just caught in the undertowEvery step that I take is another mistake to youCaught in the undertow, just caught in the undertowAnd every second I waste is more than I can takeI've become so numb, I can't feel you thereBecome so tired, so much more awareI'm becoming this, all I want to doIs be more like me and be less like youAnd I know I may end up failing, tooBut I know you were just like meWith someone disappointed in youI've become so numb, I can't feel you thereBecome so tired, so much more awareI'm becoming this, all I want to doIs be more like me and be less like youI've become so numb, I can't feel you thereI'm tired of being what you want me to beI've become so numb, I can't feel you thereI'm tired of being what you want me to be"
"23",10,"linkin park","Meteora","Somewhere I Belong","(When this began) I had nothin' to sayAnd I'd get lost in the nothingness inside of me(I was confused) And I let it all out to findThat I'm not the only person with these things in mind(Inside of me) But all the vacancy the words revealedIs the only real thing that I've got left to feel(Nothing to lose) Just stuck, hollow, and aloneAnd the fault is my own, and the fault is my ownI wanna heal, I wanna feelWhat I thought was never realI wanna let go of the pain I've held so longErase all the pain 'til it's goneI wanna heal, I wanna feelLike I'm close to something realI wanna find something I've wanted all alongSomewhere I belongAnd I've got nothin' to sayI can't believe I didn't fall right down on my face(I was confused) Lookin' everywhere only to findThat it's not the way I had imagined it all in my mind(So what am I?) What do I have but negativity?'Cause I can't justify the way everyone is lookin' at me(Nothing to lose) Nothin' to gain, hollow, and aloneAnd the fault is my own, and the fault is my ownI wanna heal, I wanna feelWhat I thought was never realI wanna let go of the pain I've held so longErase all the pain 'til it's goneI wanna heal, I wanna feelLike I'm close to something realI wanna find something I've wanted all alongSomewhere I belongI will never know myself until I do this on my ownAnd I will never feel anything else until my wounds are healedI will never be anything 'til I break away from meI will break away, I'll find myself todayI wanna heal, I wanna feelWhat I thought was never realI wanna let go of the pain I've held so longErase all the pain 'til it's goneI wanna heal, I wanna feelLike I'm close to something realI wanna find something I've wanted all alongSomewhere I belongI wanna heal, I wanna feel like I'mSomewhere I belongI wanna heal, I wanna feel like I'mSomewhere I belongSomewhere I belong"
"24",11,"linkin park","Meteora","Starving Artist","Cause every man's gotta do that thing to eatBefore he finds himself face down, passed out in the streetBut I ain't down for this industry9 to 5 to stay alive even though it's killing meAnd I'm hungry for the limelightHungry for the high life, thirsty for the fine wineAnd I'm hungry for that microphoneHungry for the live showsThirsty at the finish lineStarving artists follow your heartI know sometimes getting started's likeThe hardest partBut I'll die starving to follow this markAnd I'm going hungryNow tell me why you would ever wantTo live a life where all you're doingIs passing time until you die?And if I struggle, then I struggle forThe things that I'm trying to accomplishBefore the finish line. YeahI know you feel like every chance thatYou ever had to do the things you loveIs all gone without a traceBut it's the echoes of the pastAnd the happier times you hadTrying to escape show in linesAcross your face. And I trace em togetherYour face a constellationDrawn every morning through the steamAfter my shower's doneAnd there's some major to minorInstead I'm sick of waitingPointing straight to the sunI'll show you how it's doneAnd I'm trying hard to reach youBlowing through your speakersTrying to get inside your mindAnd I'm dying just to break throughStill I gotta eat, tooStill I gotta get byAnd if I shine, then you shine right backAnd we all in this togetherIf you feeling life is still a dreamAnd me? I'm floating down the riverAnd I ain't looking back!While I see packs of ratsTrying to swim upstreamMind is much clearer, life is so realerWine is much sweeterPancakes with the syrup!Cause one day, none of this will every matterIn the long runDJ in Heaven keeping track ofHow many times your song's spunBut in a moment it's history we createWith misery we replace so toBusy us in our day. And still you justCan't mistake the way that it feels to say""I love this song"" and watching the grinSpread on our face. Yeah!That's that shit that's worth living forAdam got a sicker flowSimilar to the kitchen thoughSometimes I swear, it's like I feelI'm on a mission, so had to break outIn flight because I feel like I'm in a prison, yoAnd life is nothing perfect, present tenseCause art is Heaven sent. I went from lawyerTo being my own employer, manThat's why I need to pedal wares and sell mySingle. So please excuse the shameless self-promotionOver strings and snares. YeahYou can give to your heart's contentI'm simply without repentanceI'm needing like every centI need it to pay the rentI need it for live eventsI need it to pay the billsFor the money already spent"
"25",1,"eminem","Music to get murdered by","Alfred (Interlude)","How do you do? Ladies and gentlemenMy name is Alfred Hitchcock and this is Music To Be Murdered ByIt is mood music in a jugular veinSo why don't you relax? Lean back and enjoy yourselfUntil the coroner comes"
"26",2,"eminem","Music to get murdered by","Alfred (Outro)","This concludes our danse macabrePortions of the proceeding were recordedAs for the rest of it, I'm very much afraid it was all in your mindI don't intend to indulge in any post-mortemIf you haven't been murdered, I can only sayBetter luck next timeIf you have been, goodnight wherever you are"
"27",3,"eminem","Music to get murdered by","Darkness","I don't wanna be alone, I don't wanna beI don't wanna be alone in the darknessI don't wanna be alone in the darknessI don't wanna be alone in the darkness anymore(Hello, darkness, my old friend)Here I am, alone againCan't get out of this hole I'm inIt's like the walls are closin' inYou can't help me, no one canI can feel these curtains closin'I go to open 'emBut something pulls 'em closed again(Hello, darkness, my old friend)Feels like I'm loathing in Las VegasHaven't got the vaguest why I'm so lostBut I'd make you this small wagerIf I bet you I'll be in tomorrow's paperWho would the odds favor?(Hello, darkness, my old friend)I'm so much like my father, you would think that I knew himI keep pacin' this room, Valium, then chase it with boozeOne little taste, it'll doMaybe I'll take it and snooze, then tear up the stage in a few(Hello, darkness, my old friend)Fuck the Colt 45, I'ma need somethin' strongerIf I pop any caps, it better be off of vodkaRound after round after round, I'm gettin' loaded (Haha)That's a lot of shots, huh? (Double entendre)(Hello, darkness, my old friend)And I don't wanna be alone in the darkness (Yeah)I don't wanna be alone in the darknessI don't wanna be alone in the darkness anymore(Hello, darkness, my old friend)Now I'm starin' at the room service menu off a benzoI can hear the music continue to crescendoI can see the whole fuckin' venue from my windowThat's when you know you're schizo(Hello, darkness, my old friend)'Cause I keep peekin' out the curtain from the hotelThe music is so loudBut it's almost as though I don't hear no soundI should get ready for the show nowWait, is this the whole crowd? I thought this shit was sold out(Hello, darkness, my old friend)But it's only the opening act, it's early, don't overreactThen something told me relaxAnd just hope for the show to be packedDon't wanna hit the stage before they fill each row to the max'Cause that'd be totally wackYou can't murder a show nobody's at(Hello darkness, my old friend)But what if nobody shows? Panic mode'Bout to snap and go motherfuckin' wacko at any second'Bout to cancel the show just as fans below rush the entrancePlan is a go to wreck shit, cameras in all directions(Hello, darkness, my old friend)The press is 'bout to go ape shit, bananas on all the networksCommando with extra clips, I got ammo for all the hecklersI'm armed to the teeth, another Valium, fall off the bedHit the ground and crawl to the dresserAlcohol on my breath as I reach for the scopeI'm blackin' out, I'm all out of medsWith them benzodiazepines goneNow it's just magazines sprawled out on the floorFuck the media, I'm goin' all out, this is war(Hello, darkness, my old friend)And I don't wanna be alone in the darkness (Yeah)I don't wanna be alone in the darknessI don't wanna be alone in the darkness anymore(Hello, darkness, my old friend)People start to show up, time to start the show upIt's 10:05 PM and the curtain starts to go upAnd I'm already sweatin', but I'm locked and loadedFor rapid fire spittin' for all the concert-goersScopes for sniper vision, surprise from out of nowhereAs I slide the clip in from inside the hotelLeanin' out the window, going Keyser SözeFinger on the trigger, but I'm a licensed ownerWith no prior convictions, so law says sky's the limitSo my supply's infinite, strapped like I'm a soldierGot 'em hopping over walls and climbing fencesSome of them John Travolta, staying alive by inches(Hello, darkness, my old friend)Cops are knockin', oh fuck, thought I blocked the entranceGuess show time is overNo suicide note, just a note for target distanceBut if you'd like to know the reason why I did thisYou'll never find a motive, truth is I have no ideaI am just as stumped, no signs of mental illnessJust tryin' to show ya the reason why we're so fucked'Cause by the time it's over, won't make the slightest difference(Hello, darkness, my old friend)And I don't wanna be alone in the darknessI don't wanna be alone in the darknessI don't wanna be alone in the darkness anymore(Hello, darkness, my old friend)Yeah, we do have some breaking news from the Associated Press right nowJust gonna bring that up because we are hearing—(I've come to talk with you again)We have told you that the shooter is deadAnd we have just learned that police are saying that the Las Vegas shooter killed himself(Hello, darkness, my old friend)That is the bartender there at Mandalay Bay and I believe we're going to hear more from her(I've come to talk with you again)Yeah, we just wanted to share that with youYou can see behind me here, this is what he looks like(Hello, darkness, my old friend)Now we did just tell you that police just earlier...Metro was telling us that he killed himself inside the hotel room(I've come to talk with you again)Good morning, as we come to you on the air(Hello, darkness, my old friend)We bring you breaking news, a school shooting (Crushing news)Another school shooting (Eleven people dead)Reports of a number of fatalities, and this time it is in Santa Fe, Texas(I've come to talk with you again)That is just outside Galveston (That no one saw coming)A mass shooting at a Southern Californian school (A suspect has been...)(Hello, darkness, my old friend)We are following breaking news this morningAnother deadly school shootingThis one in Santa Fe, Texas, that's just outside Houston(I've come to talk with you again)Twenty-six killed and twenty others wounded (Houston affiliate is reporting)At least nine people have been killed (Somber words, making it the deadliest shooting in Texas history)(Hello, darkness, my old friend)Five people deadThe attacker opening fire outside the church during a morning worship sessionHe unloaded the chaotic and terror, making his way inside (Five people killed in a workplace shooting, dozens of officers)(I've come to talk with you again)This, a deadly shooting at a food festival in Northern California(Hello, darkness, my old friend)Three people so far deadBreaking news (Fifteen wounded)A deadly shooting at a newspaper office in Annapolis (A gunman opened fire)(I've come to talk with you again)Newly-released surveillance video shows the moments leading up to a mass shooting in Dayton, OhioAuthorities say the shooter..."
